,0
北京大学艺术学院,4
教育部高等教育司,4
清华大学教育研究院,4
吉林大学法学院,4
北京大学慕课工作组,3
武汉大学本科生院,3
北京大学信息科学技术学院,3
武汉大学文学院,2
南京大学教育研究院,2
扬州大学教务处,2
中国法学会法学教育研究会,2
中国石油大学(华东),2
西北工业大学,2
中国科学院,2
沈阳化工大学,2
北京化工大学教务处,2
南京大学教务处,2
武汉大学教育科学研究院,2
教育部高等教育司理工科教育处,2
中国工程院,2
南京农业大学,2
清华大学,2
南京大学,2
湖南文理学院,2
东南大学,2
西安交通大学,2
重庆大学东西部高校课程共享联盟秘书处,2
重庆大学,2
陕西师范大学,2
广西师范大学文学院,2
扬州商务高等职业学校,1
常州工学院,1
山东大学化学与化工学院,1
山东大学教学促进与教师发展中心,1
山西大学商务学院,1
武汉大学教育学院,1
武汉大学中国语情与社会发展中心,1
常州工学院教务处教学建设科,1
武汉大学文学院汉语言文化系,1
广州大学教务处,1
暨南大学经济学院,1
山东大学,1
武汉大学新闻与传播学院,1
广州工程技术职业学院,1
安徽师范大学团委,1
武汉大学汉语国际推广教学资源研究与开发基地,1
武汉大学艺术学院,1
武汉大学质量管理处,1
武汉理工大学,1
江苏大学,1
江苏省委教育工委,1
江苏省教育厅,1
宁波工程学院,1
沈阳药科大学教务处教材科,1
河北大学教务处,1
河北经贸大学人文学院,1
河北金融学院保险系,1
昌吉学院,1
广西大学化学化工学院,1
广西大学,1
教育部职业技术教育中心教师资源研究室,1
扬州大学创新创业学院,1
成都信息工程大学计算机学院计算机应用教研室,1
扬州大学广陵学院专业部,1
扬州大学广陵学院机电系,1
思科系统(中国)公司,1
广西民族大学民族预科教育学院,1
广西师范学院外国语学院,1
扬州大学教育教学评估中心,1
教育部,1
广西大学研究生院,1
教育部思想政治工作司,1
教育部社会科学委员会哲学学部,1
教育部高等学校中国语言文学类教学指导委员会,1
扬州大学,1
教育部高等学校化学类专业教学指导委员会,1
浙江万里学院教育发展研究中心,1
教育部高等学校化工类专业教学指导委员会,1
教育部高等学校哲学类专业教学指导委员会,1
教育部高等学校地质学类专业教学指导委员会,1
教育部高等学校大学外语教学指导委员会,1
教育部高等学校大学计算机课程教学指导委员会,1
教育部高等学校机械基础课程教学指导委员会,1
教育部高等学校环境科学与工程类专业教学指导委员会,1
教育部高等学校经济与贸易类专业教学指导委员会,1
教育部高等学校药学类教学指导委员会,1
教育部高等学校计算机类专业教学指导委员会,1
河南大学文学院,1
浙江工商大学,1
浙江大学,1
西北工业大学党委组织部,1
西南财经大学教务处,1
西南石油大学,1
西南交通大学土木工程学院,1
西北工业大学机电学院,1
西北工业大学教育实验学院,1
西北工业大学学生注册中心,1
西北大学研究生院,1
西安工业大学,1
苏州大学教育科学研究院,1
福建农林大学生命科学学院生物科学系,1
福建农林大学,1
福州大学教务处,1
福州大学厦门工艺美术学院艺术史论系,1
盐城师范学院社会学院,1
西安交通大学国家级教师教学发展示范中心,1
西安工程大学研究生部,1
湖南师范大学,1
陕西师范大学文学院,1
高等教育出版社理工出版事业部化学分社,1
高等教育出版社,1
首都师范大学科德学院,1
首都体育学院国际教育学院,1
韩山师范学院文学与新闻传播学院,1
陕西理工大学文学院,1
陕西师范大学教师教育办公室,1
西安工程大学管理学院,1
陕西师范大学教师教学发展中心,1
闽南师范大学化学与环境学院,1
闽南师范大学,1
重庆大学高等教育研究所,1
辽宁大学历史学院,1
贵州民族大学民族文化与认知科学学院,1
湖南师范大学商学院,1
湖南安全技术职业学院,1
浙江大学中文系,1
浙江师范大学,1
浙江金融职业学院党委,1
浙江财经大学教务处,1
浙江科技学院外国语学院,1
浙江省部共建办公室,1
浙江省社会科学界联合会,1
浙江海洋大学,1
太原理工大学煤炭资源开采利用与装备工程国家级实验教学示范中心,1
淮阴师范学院,1
浙江工业大学发展规划处,1
浙江大学本科生院,1
浙江大学教务处,1
浙江大学外语学院,1
浙江大学光电科学与工程学院,1
浙江大学光华法学院,1
浙江金融职业学院工商管理学院,1
清华大学发展规划处,1
湖南大学化学化工学院,1
温州大学教师教学发展中心,1
湖北第二师范学院湖北教师教育研究中心,1
湖北第二师范学院教务处,1
湖北第二师范学院,1
温州大学网络工程系,1
温州大学网络工程国家级虚拟仿真实验教学中心,1
温州大学物理与电子信息工程学院,1
温州医科大学高等教育研究所,1
清华大学国际工程教育中心,1
温州医科大学第二临床医学院,1
温州医科大学第一临床医学院,1
清华大学美术学院,1
清华大学电机系,1
清华大学环境学院,1
清华大学学生学习与发展指导中心,1
宁波大学法学院,1
复旦大学微电子学院,1
太原理工大学教务处,1
中国计量大学,1
北京化工大学经济管理学院,1
北京交通大学经济管理学院,1
内蒙古师范大学文学院,1
内蒙古大学教务处实践教学科,1
内蒙古大学教务处,1
兰州理工大学文学院(国际教育学院),1
兰州大学,1
全国高等学校教学研究中心,1
云南大学法学院,1
临沂大学法学院,1
中山大学生命科学学院,1
中央财经大学法学院,1
中国高等教育学会新闻学与传播学专业委员会,1
中国高等教育学会工程教育专业委员会,1
中国高等教育学会,1
北京外国语大学,1
北京外国语大学网络教育学院学历教学部,1
北京大学中文系,1
北京大学艺术学院美术学系,1
北京市朝阳区职工大学,1
北京市教育委员会,1
北京工业大学高等教育研究所,1
北京工业大学教师教学发展中心工作委员会,1
北京工业大学人文学院,1
北京工业大学,1
北京大学艺术学院影视学系,1
北京大学哲学系/外国哲学研究所,1
北京大学社会科学部,1
北京大学文化产业研究院,1
北京大学数学科学学院,1
北京大学教育学院,1
北京大学学科建设办公室,1
北京大学国家发展研究院,1
中国计量大学机电工程学院实验中心,1
中国计算机学会,1
北京师范大学教育学部,1
中国药科大学教务处,1
中南财经政法大学武汉学院,1
中南大学软件学院学工办,1
中南大学软件学院,1
东莞理工学院继续教育学院,1
东南大学教务处,1
东北师范大学,1
上海电机学院教学质量管理办公室,1
上海市教育评估院,1
上海对外经贸大学高等教育研究所,1
上海大学土木工程系,1
上海公安高等专科学校办公室,1
上海交通大学致远学院,1
上海交通大学电子信息与电气工程学院计算机科学与工程系,1
上海交通大学物理学院,1
上海交通大学巴黎高科工程师学院,1
中国人民大学哲学院,1
中国人民大学外国语学院,1
中国人民大学新闻学院,1
中国教育学会,1
中国药科大学,1
中国矿业大学(北京)机电与信息工程学院,1
中国石油大学(华东)高教研究与评估中心,1
中国石油大学(华东)化学工程学院,1
中国法学会,1
中国教育技术协会学术委员会,1
中国政法大学人文学院,1
中国人民大学法学院,1
中国地质大学(武汉)马克思主义学院,1
中国地质大学(武汉)公共管理学院,1
中国农业大学资源与环境学院,1
中国农业大学人文与发展学院社会学系,1
中国农业大学人文与发展学院,1
中国传媒大学文法学部对外汉语教育中心,1
北京师范大学哲学学院,1
北京师范大学教育学部高等教育研究所,1
天津大学管理与经济学部,1
南京师范大学社会发展学院,1
哈尔滨工业大学,1
吉林师范大学生命科学学院,1
吉林大学理论法学研究中心,1
吉林大学教务处,1
吉林大学公共外交学院,1
吉林大学,1
合肥工业大学教务部学生注册中心,1
厦门大学现代教育技术与实践训练中心,1
厦门大学教育研究院,1
厦门大学化学化工学院,1
南开大学哲学学院,1
南京财经大学国际经贸学院,1
南京航空航天大学航空宇航学院,1
南京航空航天大学发展研究中心政策研究室,1
南京航空航天大学,1
哈尔滨工业大学威海校区,1
哈尔滨工业大学计算机科学与技术学院,1
哈尔滨工业大学计算机科学与技术学院国家级实验教学示范中心,1
复旦大学创新创业学院,1
天津大学,1
天津化学化工协同创新中心,1
大连理工大学高等教育研究院,1
大连理工大学,1
大连大学教务处,1
三亚学院,1
复旦大学中国语言文学研究所吴语研究室,1
嘉兴学院商学院,1
复旦大学中国语言文学研究所,1
复旦大学上海医学院,1
国务院学位委员会法学学科评议组,1
四川大学华西公共卫生学院,1
嘉兴学院资产与实验室管理处,1
嘉兴学院应用技术学院,1
南京理工大学教务处,1
南京师范大学教育科学学院,1
北京师范大学文学院,1
南京师范大学教务处,1
华中科技大学学术委员会,1
华中师范大学文学院,1
华中师范大学教务处,1
华中师范大学化学学院,1
华中农业大学教务处,1
华中农业大学,1
北京语言大学,1
北京航空航天大学法学院,1
北京第二外国语学院通识教育学院,1
北京第二外国语学院经贸与会展学院,1
北京石油化工学院经济管理学院,1
北京理工大学自动化学院,1
北京师范大学经济与工商管理学院,1
北京师范大学社会学院人类学民俗学系,1
北京师范大学社会学院,1
华中科技大学教育科学研究院,1
华中科技大学文华学院,1
华中科技大学生命科学与技术学院,1
南京大学地理与海洋科学学院党委,1
南京工程学院经济与管理学院,1
南京工程学院教学质量管理办公室,1
南京工程学院,1
南京审计大学高教研究所,1
南京审计大学经济与贸易学院,1
南京大学外国语学院,1
南京农业大学教师发展中心,1
华中科技大学计算机学院,1
南京农业大学人文与社会发展学院,1
华南师范大学教育科学学院,1
华南师范大学教务处,1
华北电力大学经济与管理学院,1
华北电力大学研究生院,1
华中科技大学贝时璋菁英班管理办公室,1
黑龙江大学马克思主义学院,1
